article_id,symbol,company,date_publication,source,api_source,titre,contenu,score_sentiment,sentiment,confiance,poids,score_pondere,url,date_analyse,ajout_date
1572a4aa675d2e86,TSLA,Tesla,2026-04-17,GlobeNewswire,newsapi,Purpose Investments Inc. Announces April 2026 Distributions,"Purpose Investments Inc. Announces April 2026 Distributions. TORONTO, April 17, 2026 (GLOBE NEWSWIRE) -- Purpose Investments Inc. (Purpose) is pleased to announce distributions for the month of April 2026 for its open-end exchange traded funds and closed-end f… [+13479 chars]",0.738,positive,0.738,1.3,0.956,https://www.globenewswire.com/news-release/2026/04/17/3276537/0/en/Purpose-Investments-Inc-Announces-April-2026-Distributions.html,2026-04-20 20:16:12,2026-04-20
d516889925bb4487,TSLA,Tesla,2026-04-17,Investor's Business Daily,gnews,Dow Jones Futures: What To Do Amid Historic Stock Market Run; Tesla Flashes Buy Signal With Earnings Due,"Dow Jones Futures: What To Do Amid Historic Stock Market Run; Tesla Flashes Buy Signal With Earnings Due. Information in Investor’s Business Daily is for informational and educational purposes only and should not be construed as an offer, recommendation, solicitation, or rating to buy or sell securi...",0.0,neutral,0.949,1.08,0.0,https://www.investors.com/market-trend/stock-market-today/dow-jones-futures-tesla-buy-signal-earnings-due/,2026-04-20 20:16:12,2026-04-20
ab89011d80282d0f,TSLA,Tesla,2026-04-17,24/7 Wall St.,newsapi,Tesla Rallies 5% as Q1 Earnings Loom: A 33% Profit Surge Estimate Has Investors Watching Closely,"Tesla Rallies 5% as Q1 Earnings Loom: A 33% Profit Surge Estimate Has Investors Watching Closely. <ul><li>Tesla (TSLA) stock gained 5% Friday on Q1 2026 earnings anticipation ahead of April 22 report, with Wall Street expecting 33% EPS growth versus Q1 2025s $0.12.
</li><li>Teslas favorable earn… [...",0.944,positive,0.944,1.3,1.223,https://247wallst.com/investing/2026/04/17/tesla-rallies-5-as-q1-earnings-loom-a-33-profit-surge-estimate-has-investors-watching-closely/,2026-04-20 20:16:12,2026-04-20
1bb761330fdc2aae,TSLA,Tesla,2026-04-19,Yahoo Entertainment,newsapi,The AI trade is fueling the market to record highs despite Iran war,"The AI trade is fueling the market to record highs despite Iran war. The AI trade has fueled the market to all-time highs, even with continuing uncertainty in the Middle East.
Fears of supply shocks for everything from natural gas to helium didn't materialize enough … [+2462 chars]",0.919,positive,0.919,1.58,1.456,https://finance.yahoo.com/news/the-ai-trade-is-fueling-the-market-to-record-highs-despite-iran-war-130540185.html,2026-04-20 20:16:12,2026-04-20
c7355bd4284253f0,TSLA,Tesla,2026-04-18,Markets Insider,gnews,Tesla Will Report Q1 Earnings on April 22 - Bulls and Bears Clash Over TSLA Stock Targets,"Tesla Will Report Q1 Earnings on April 22 - Bulls and Bears Clash Over TSLA Stock Targets. Tesla (TSLA) will release its Q1 2026 earnings next week on April 22 after the market closes. The stock has gained 14.5% in the last five days and has crossed the $400 level. Meanwhile, Wall Street is deeply s...",-0.733,negative,0.733,1.08,-0.792,https://markets.businessinsider.com/news/stocks/tesla-will-report-q1-earnings-on-april-22-bulls-and-bears-clash-over-tsla-stock-targets-1036033712,2026-04-20 20:16:12,2026-04-20
5a7bf33d257bd9c1,TSLA,Tesla,2026-04-19,Investing.com,gnews,"1 Stock to Buy, 1 Stock to Sell This Week: Tesla, Intel","1 Stock to Buy, 1 Stock to Sell This Week: Tesla, Intel. Iran war developments, U.S. retail sales data, Q1 earnings season kicks into high gear during the week ahead.
Tesla’s turnaround momentum and high-stakes guidance make it a buy candidate.
Intel’s overextended run and profit risk flag it as a s...",0.768,positive,0.768,1.32,1.013,https://www.investing.com/analysis/1-stock-to-buy-1-stock-to-sell-this-week-tesla-intel-200678726,2026-04-20 20:16:12,2026-04-20
71dd499751e82366,TSLA,Tesla,2026-04-17,Financial Post,newsapi,Purpose Investments Inc. Announces April 2026 Distributions,"Purpose Investments Inc. Announces April 2026 Distributions. TORONTO, April 17, 2026 (GLOBE NEWSWIRE) Purpose Investments Inc. (Purpose) is pleased to announce distributions for the month of April 2026 for its open-end exchange traded funds and closed-end fund… [+15557 chars]",0.726,positive,0.726,1.3,0.941,https://financialpost.com/globe-newswire/purpose-investments-inc-announces-april-2026-distributions,2026-04-20 20:16:12,2026-04-20
48a88fada26eff18,TSLA,Tesla,2026-04-17,Investor's Business Daily,gnews,"Stock Market Rallies As Strait Of Hormuz Reopens; U.S.-Iran Talks, Tesla Earnings Loom","Stock Market Rallies As Strait Of Hormuz Reopens; U.S.-Iran Talks, Tesla Earnings Loom. Information in Investor’s Business Daily is for informational and educational purposes only and should not be construed as an offer, recommendation, solicitation, or rating to buy or sell securities. The informat...",0.0,neutral,0.946,1.08,0.0,https://www.investors.com/market-trend/the-big-picture/dow-jones-stock-market-rallies-nasdaq-strait-of-hormuz-reopens-iran-talks-tesla-earnings-loom/,2026-04-20 20:16:12,2026-04-20
2ad4df566b140c89,NVDA,Nvidia,2026-04-17,MarketWatch,newsapi,Nasdaq scores longest winning streak since 1992 as historic stock-market comeback continues,"Nasdaq scores longest winning streak since 1992 as historic stock-market comeback continues. The stock markets rebound continued to pick up speed Friday. - Getty Images/iStockphoto
A rally that has already catapulted stocks higher with a velocity rarely seen before continued to pick up spee… [+4092...",0.932,positive,0.932,1.3,1.208,https://www.marketwatch.com/story/nasdaq-heads-toward-its-longest-winning-streak-since-1992-as-historic-stock-market-comeback-continues-e84c2c59,2026-04-20 20:16:15,2026-04-20
9296d01e9bbe4dad,NVDA,Nvidia,2026-04-18,Yahoo Entertainment,newsapi,Morning Brief: The future of Netflix is now,"Morning Brief: The future of Netflix is now. Good morning! The stock market put in another surge on Friday to close out a week of record highs.
The big catalyst? Iran said the Strait of Hormuz is open for business as talks seemed to bear fruit… [+7779 chars]",0.732,positive,0.732,1.3,0.948,https://finance.yahoo.com/news/morning-brief-the-future-of-netflix-is-now-100051740.html,2026-04-20 20:16:15,2026-04-20
2c587fdad24968db,NVDA,Nvidia,2026-04-17,The Economic Times,gnews,AMD UALink strategy: Can AMD disrupt AI data center dominance as open interconnect challenges NVIDIA NVLink ecosystem control?,"AMD UALink strategy: Can AMD disrupt AI data center dominance as open interconnect challenges NVIDIA NVLink ecosystem control?. Synopsis
AMD UALink Standard is driving a major shift in AI infrastructure right now. Advanced Micro Devices is leading this open interconnect push as AI cluster demand sur...",0.938,positive,0.938,1.08,1.013,https://economictimes.indiatimes.com/news/international/us/amd-ualink-strategy-can-amd-disrupt-ai-data-center-dominance-as-open-interconnect-challenges-nvidia-nvlink-ecosystem-control/articleshow/130342517.cms,2026-04-20 20:16:15,2026-04-20
c9d9b570d6591145,NVDA,Nvidia,2026-04-17,24/7 Wall St.,newsapi,This Hedge Fund-Favored Semi Stock is on the Cusp of a Multi-Year Breakout,This Hedge Fund-Favored Semi Stock is on the Cusp of a Multi-Year Breakout. <ul><li>The Stocks:Texas Instruments (TXN) is a legacy analog chip and embedded processor maker trading near all-time highs with a partnership with Nvidia (NVDA) on physical AI applications; the stoc… [+4802 chars],0.893,positive,0.893,1.3,1.157,https://247wallst.com/investing/2026/04/17/this-hedge-fund-favored-semi-stock-is-on-the-cusp-of-a-multi-year-breakout/,2026-04-20 20:16:15,2026-04-20
66de41d8ad7c5a75,NVDA,Nvidia,2026-04-17,GlobeNewswire,newsapi,Quantify Funds to Close STKd 100% NVDA & 100% AMD ETF (LAYS),"Quantify Funds to Close STKd 100% NVDA & 100% AMD ETF (LAYS). NEW YORK, April 17, 2026 (GLOBE NEWSWIRE) -- Quantify Funds, in coordination with Tidal Investments LLC, today announced the closure and liquidation of STKd 100% NVDA &amp; 100% AMD ETF (Ticker: LAYS… [+1680 chars]",0.0,neutral,0.656,1.3,0.0,https://www.globenewswire.com/news-release/2026/04/17/3276495/0/en/Quantify-Funds-to-Close-STKd-100-NVDA-100-AMD-ETF-LAYS.html,2026-04-20 20:16:15,2026-04-20
1bb761330fdc2aae,NVDA,Nvidia,2026-04-19,Yahoo Entertainment,newsapi,The AI trade is fueling the market to record highs despite Iran war,"The AI trade is fueling the market to record highs despite Iran war. The AI trade has fueled the market to all-time highs, even with continuing uncertainty in the Middle East.
Fears of supply shocks for everything from natural gas to helium didn't materialize enough … [+2462 chars]",0.919,positive,0.919,1.58,1.456,https://finance.yahoo.com/news/the-ai-trade-is-fueling-the-market-to-record-highs-despite-iran-war-130540185.html,2026-04-20 20:16:15,2026-04-20
e803a8cc8ed7ec60,NVDA,Nvidia,2026-04-18,Yahoo Entertainment,newsapi,Nvidia Corp. (NVDA) Announces New Open-Source Quantum AI Model,"Nvidia Corp. (NVDA) Announces New Open-Source Quantum AI Model. NVIDIA Corp. (NASDAQ:NVDA) is one of the 10 Best Data Center Stocks To Buy For the Long Term. In the past year, the stock grew 95.44%, while it posted 5.03% year-to-date growth. On April 14, NVIDIA a… [+2064 chars]",0.722,positive,0.722,1.3,0.936,https://finance.yahoo.com/markets/stocks/articles/nvidia-corp-nvda-announces-open-084809766.html,2026-04-20 20:16:15,2026-04-20
cf4aed734783bf3d,NVDA,Nvidia,2026-04-17,Barchart.com,newsapi,Marvell Technology Stock Just Hit New All-Time Highs. Should You Buy It Here?,"Marvell Technology Stock Just Hit New All-Time Highs. Should You Buy It Here?. Marvell Technology (MRVL) is a premier fabless semiconductor designer specializing in data infrastructure. Originally established as a storage-focused company, Marvell has undergone a strategic trans… [+3909 chars]",0.0,neutral,0.564,1.3,0.0,https://www.barchart.com/story/news/1367532/marvell-technology-stock-just-hit-new-all-time-highs-should-you-buy-it-here,2026-04-20 20:16:15,2026-04-20
303503015381dc1e,NVDA,Nvidia,2026-04-17,Yahoo Entertainment,newsapi,Allbirds stock gains 350% this week as shoemaker pivots to AI,"Allbirds stock gains 350% this week as shoemaker pivots to AI. Allbirds (BIRD) stock fell on Friday, capping a roller-coaster week for the company following its announcement that it's shifting from a sustainable sneaker business to an artificial intelligence com… [+2701 chars]",-0.975,negative,0.975,1.3,-1.263,https://finance.yahoo.com/news/allbirds-stock-gains-350-this-week-as-shoemaker-pivots-to-ai-205243380.html,2026-04-20 20:16:16,2026-04-20
3f2ccc0f4509e95b,GOOGL,Google,2026-04-18,The Economic Times,gnews,Social media outlets told to take down fake NSE accounts,"Social media outlets told to take down fake NSE accounts. Synopsis
The Bombay High Court has ordered social media platforms and domain registrars to remove fake accounts and websites impersonating the National Stock Exchange (NSE). The court granted interim relief to NSE, directing platforms like X ...",-0.88,negative,0.88,1.08,-0.95,https://economictimes.indiatimes.com/markets/stocks/news/social-media-outlets-told-to-take-down-fake-nse-accounts/articleshow/130345979.cms,2026-04-20 20:16:18,2026-04-20
1bb761330fdc2aae,GOOGL,Google,2026-04-19,Yahoo Entertainment,newsapi,The AI trade is fueling the market to record highs despite Iran war,"The AI trade is fueling the market to record highs despite Iran war. The AI trade has fueled the market to all-time highs, even with continuing uncertainty in the Middle East.
Fears of supply shocks for everything from natural gas to helium didn't materialize enough … [+2462 chars]",0.919,positive,0.919,1.58,1.456,https://finance.yahoo.com/news/the-ai-trade-is-fueling-the-market-to-record-highs-despite-iran-war-130540185.html,2026-04-20 20:16:18,2026-04-20
2ad4df566b140c89,GOOGL,Google,2026-04-17,MarketWatch,newsapi,Nasdaq scores longest winning streak since 1992 as historic stock-market comeback continues,"Nasdaq scores longest winning streak since 1992 as historic stock-market comeback continues. The stock markets rebound continued to pick up speed Friday. - Getty Images/iStockphoto
A rally that has already catapulted stocks higher with a velocity rarely seen before continued to pick up spee… [+4092...",0.932,positive,0.932,1.3,1.208,https://www.marketwatch.com/story/nasdaq-heads-toward-its-longest-winning-streak-since-1992-as-historic-stock-market-comeback-continues-e84c2c59,2026-04-20 20:16:18,2026-04-20
62f9b79994430758,GOOGL,Google,2026-04-17,Barchart.com,newsapi,"As GitLab Expands Its Google Cloud Deal, Should You Buy GTLB Stock?","As GitLab Expands Its Google Cloud Deal, Should You Buy GTLB Stock?. GitLab (GTLB), an all-remote pioneer, is the leading platform for intelligent software orchestration. Originally a source code management tool, GitLab has evolved into a comprehensive DevSecOps power… [+4546 chars]",0.0,neutral,0.731,1.3,0.0,https://www.barchart.com/story/news/1371718/as-gitlab-expands-its-google-cloud-deal-should-you-buy-gtlb-stock,2026-04-20 20:16:18,2026-04-20
71dd499751e82366,GOOGL,Google,2026-04-17,Financial Post,newsapi,Purpose Investments Inc. Announces April 2026 Distributions,"Purpose Investments Inc. Announces April 2026 Distributions. TORONTO, April 17, 2026 (GLOBE NEWSWIRE) Purpose Investments Inc. (Purpose) is pleased to announce distributions for the month of April 2026 for its open-end exchange traded funds and closed-end fund… [+15557 chars]",0.726,positive,0.726,1.3,0.941,https://financialpost.com/globe-newswire/purpose-investments-inc-announces-april-2026-distributions,2026-04-20 20:16:18,2026-04-20
1572a4aa675d2e86,GOOGL,Google,2026-04-17,GlobeNewswire,newsapi,Purpose Investments Inc. Announces April 2026 Distributions,"Purpose Investments Inc. Announces April 2026 Distributions. TORONTO, April 17, 2026 (GLOBE NEWSWIRE) -- Purpose Investments Inc. (Purpose) is pleased to announce distributions for the month of April 2026 for its open-end exchange traded funds and closed-end f… [+13479 chars]",0.738,positive,0.738,1.3,0.956,https://www.globenewswire.com/news-release/2026/04/17/3276537/0/en/Purpose-Investments-Inc-Announces-April-2026-Distributions.html,2026-04-20 20:16:18,2026-04-20
6ee7505ec83a2273,AMZN,Amazon,2026-04-19,Yahoo Entertainment,newsapi,Jim Cramer Shares Why Amazon.com (AMZN) is Better Than Microsoft,"Jim Cramer Shares Why Amazon.com (AMZN) is Better Than Microsoft. If you click 'Accept all', we and our partners, including 251 who are part of the IAB Transparency &amp; Consent Framework, will also store and / or access information on a device (in other words, us… [+1046 chars]",0.0,neutral,0.923,1.32,0.0,https://consent.yahoo.com/v2/collectConsent?sessionId=1_cc-session_03d7b68f-1cb3-4eab-a0e9-efeeafe5ec1b,2026-04-20 20:16:21,2026-04-20
1bb761330fdc2aae,AMZN,Amazon,2026-04-19,Yahoo Entertainment,newsapi,The AI trade is fueling the market to record highs despite Iran war,"The AI trade is fueling the market to record highs despite Iran war. The AI trade has fueled the market to all-time highs, even with continuing uncertainty in the Middle East.
Fears of supply shocks for everything from natural gas to helium didn't materialize enough … [+2462 chars]",0.919,positive,0.919,1.58,1.456,https://finance.yahoo.com/news/the-ai-trade-is-fueling-the-market-to-record-highs-despite-iran-war-130540185.html,2026-04-20 20:16:21,2026-04-20
71dd499751e82366,AMZN,Amazon,2026-04-17,Financial Post,newsapi,Purpose Investments Inc. Announces April 2026 Distributions,"Purpose Investments Inc. Announces April 2026 Distributions. TORONTO, April 17, 2026 (GLOBE NEWSWIRE) Purpose Investments Inc. (Purpose) is pleased to announce distributions for the month of April 2026 for its open-end exchange traded funds and closed-end fund… [+15557 chars]",0.726,positive,0.726,1.3,0.941,https://financialpost.com/globe-newswire/purpose-investments-inc-announces-april-2026-distributions,2026-04-20 20:16:21,2026-04-20
9296d01e9bbe4dad,AMZN,Amazon,2026-04-18,Yahoo Entertainment,newsapi,Morning Brief: The future of Netflix is now,"Morning Brief: The future of Netflix is now. Good morning! The stock market put in another surge on Friday to close out a week of record highs.
The big catalyst? Iran said the Strait of Hormuz is open for business as talks seemed to bear fruit… [+7779 chars]",0.732,positive,0.732,1.3,0.948,https://finance.yahoo.com/news/morning-brief-the-future-of-netflix-is-now-100051740.html,2026-04-20 20:16:21,2026-04-20
2ad4df566b140c89,AMZN,Amazon,2026-04-17,MarketWatch,newsapi,Nasdaq scores longest winning streak since 1992 as historic stock-market comeback continues,"Nasdaq scores longest winning streak since 1992 as historic stock-market comeback continues. The stock markets rebound continued to pick up speed Friday. - Getty Images/iStockphoto
A rally that has already catapulted stocks higher with a velocity rarely seen before continued to pick up spee… [+4092...",0.932,positive,0.932,1.3,1.208,https://www.marketwatch.com/story/nasdaq-heads-toward-its-longest-winning-streak-since-1992-as-historic-stock-market-comeback-continues-e84c2c59,2026-04-20 20:16:21,2026-04-20
1572a4aa675d2e86,AMZN,Amazon,2026-04-17,GlobeNewswire,newsapi,Purpose Investments Inc. Announces April 2026 Distributions,"Purpose Investments Inc. Announces April 2026 Distributions. TORONTO, April 17, 2026 (GLOBE NEWSWIRE) -- Purpose Investments Inc. (Purpose) is pleased to announce distributions for the month of April 2026 for its open-end exchange traded funds and closed-end f… [+13479 chars]",0.738,positive,0.738,1.3,0.956,https://www.globenewswire.com/news-release/2026/04/17/3276537/0/en/Purpose-Investments-Inc-Announces-April-2026-Distributions.html,2026-04-20 20:16:21,2026-04-20
05e083b26257d9f7,AMZN,Amazon,2026-04-19,Rlsbb.to,newsapi,Be My Guest With Ina Garten S07E02 1080p AMZN WEB-DL H264-RAWR,"Be My Guest With Ina Garten S07E02 1080p AMZN WEB-DL H264-RAWR. Season 7, Episode 02 “Jon Batiste”Ina welcomes Jon Batiste with Peanut Butter and Jelly Bars for a taste of nostalgia before their memorable conversation begins. Jon shares secret superpowers to stay… [+776 chars]",0.0,neutral,0.908,1.58,0.0,https://post.rlsbb.to/be-my-guest-with-ina-garten-s07e02-1080p-amzn-web-dl-h264-rawr/,2026-04-20 20:16:21,2026-04-20
c02ee4937b221760,AMZN,Amazon,2026-04-19,TheStreet,newsapi,Goldman Sachs’ blunt words for Amazon stock investors after big deal,"Goldman Sachs’ blunt words for Amazon stock investors after big deal. Amazon (AMZN) just completed a massive new deal, and Goldman Sachs thinks investors need to see the bigger picture.
For perspective, Amazon has entered into an agreement to acquire Globalstar, allow… [+5397 chars]",0.0,neutral,0.82,1.58,0.0,https://www.thestreet.com/investing/stocks/goldman-sachs-blunt-words-for-amazon-stock-investors-after-big-deal,2026-04-20 20:16:21,2026-04-20
4f9d431f7ebaa5cd,META,Meta,2026-04-19,Business Insider,newsapi,Top Indeed exec details why they'll never have a 'Tokenmaxxing'-esque leaderboard,Top Indeed exec details why they'll never have a 'Tokenmaxxing'-esque leaderboard. Indeed CIO Anthony Moisant said the company previously made the mistake of following easy-to-track metrics like token use that aren't tied to outcomes.Jordan Vonderhaar/Bloomberg/Bloomberg via Getty … [+3894 chars],0.0,neutral,0.675,1.58,0.0,https://www.businessinsider.com/indeed-ai-usage-bills-tokens-leaderboard-anthony-moisant-2026-4,2026-04-20 20:16:24,2026-04-20
f100e629b64b92a8,META,Meta,2026-04-18,TheStreet,newsapi,Bank of America revamps AMD stock price target,"Bank of America revamps AMD stock price target. Advanced Micro Devices (AMD) has gained about 42% in the past month, according to Yahoo Finance at the time of writing, Friday afternoon, April 17. Meanwhile, the SPDR S&amp;P 500 index (SPY) is up s… [+3584 chars]",0.946,positive,0.946,1.58,1.499,https://www.thestreet.com/investing/stocks/bank-of-america-revamps-amd-stock-price-target,2026-04-20 20:16:24,2026-04-20
d8133cc62a61b1d5,META,Meta,2026-04-18,Yahoo Entertainment,newsapi,Meta Platforms (META) Expands AI Chip Deal with Broadcom,"Meta Platforms (META) Expands AI Chip Deal with Broadcom. Meta Platforms, Inc. (NASDAQ:META) is one of the 10 Unrivaled Stocks of the Next 5 Years. On April 14, Reuters reported that Meta Platforms, Inc. (NASDAQ:META) has expanded its partnership with Broad… [+1991 chars]",0.947,positive,0.947,1.3,1.228,https://finance.yahoo.com/sectors/technology/articles/meta-platforms-meta-expands-ai-184721791.html,2026-04-20 20:16:24,2026-04-20
1b2fa0b93fe4e318,META,Meta,2026-04-19,Android Central,newsapi,Prices on tech are going up everywhere... are you less likely to buy a new phone this year?,"Prices on tech are going up everywhere... are you less likely to buy a new phone this year?. We were warned about the RAM shortage at the tail end of 2025, but now it's becoming a major problem throughout the tech industry. Tech companies are beginning to increase the prices of their devices… [+2310...",-0.9,negative,0.9,1.58,-1.426,https://www.androidcentral.com/phones/poll-are-you-less-likely-to-buy-a-new-phone-this-year,2026-04-20 20:16:24,2026-04-20
121ddab7316ce991,META,Meta,2026-04-18,Gizmodo.com,newsapi,RAM Shortage Expected to Continue Into Next Year or Later,"RAM Shortage Expected to Continue Into Next Year or Later. A report by the Japan-based, English-language magazine Nikkei Asia looked at the state of the memory business in East Asia lately, and, long story short: demand is still astronomical, and progress to… [+2239 chars]",-0.861,negative,0.861,1.3,-1.116,https://gizmodo.com/ram-shortage-expected-to-continue-into-next-year-or-later-2000748208,2026-04-20 20:16:24,2026-04-20
f752c7cdffcfcc64,META,Meta,2026-04-19,Android Central,newsapi,The Ray-Ban Meta (Gen 1) smart glasses just scored a rare 25% discount at Amazon,"The Ray-Ban Meta (Gen 1) smart glasses just scored a rare 25% discount at Amazon. Those in search of cheap smart glasses won't find much, unless you're cool waiting for a discount to hit or going last-generation. Luckily, Amazon is offering both by chopping 25% off the price of th… [+2100 chars]",0.795,positive,0.795,1.58,1.259,https://www.androidcentral.com/wearables/the-ray-ban-meta-gen-1-smart-glasses-just-scored-a-rare-25-percent-discount-at-amazon,2026-04-20 20:16:24,2026-04-20
b83a53ee05dc020c,META,Meta,2026-04-17,Business Insider,newsapi,"2 reasons you should wait to pile into the market's resurgent tech trade, according to SocGen's US stock chief","2 reasons you should wait to pile into the market's resurgent tech trade, according to SocGen's US stock chief. Tech stocks are again the market's hottest trade but Société Générale's Chief US Equity Strategist, Manish Kabra, says not so fast.
The AI scare trade sent tech stocks plummeting earlier ...",-0.864,negative,0.864,1.3,-1.12,https://www.businessinsider.com/investing-tips-buy-tech-stocks-ai-capex-hyperscalers-sp500-outlook-2026-4,2026-04-20 20:16:24,2026-04-20
66e7bfb946bef882,META,Meta,2026-04-17,Boredpanda.com,newsapi,“Best And Worst Of Twitter”: 33 Screenshots From X That Are Funnier Than They Should Be,"“Best And Worst Of Twitter”: 33 Screenshots From X That Are Funnier Than They Should Be. There are many differences between social networks like the controversial X (formerly Twitter) and Facebook, owned by Meta. Not just on a technical level, but on a cultural one, too.
Initially, Twit… [+429 char...",0.0,neutral,0.788,1.3,0.0,https://www.boredpanda.com/random-funny-tweets/,2026-04-20 20:16:24,2026-04-20
659eccd8a290db91,AAPL,Apple,2026-04-20,Yahoo Entertainment,newsapi,2 charts show why Magnificent 7 stocks are being loved again,"2 charts show why Magnificent 7 stocks are being loved again. With geopolitical tensions simmering down ever so slightly versus March's hysteria, investors are back on the hunt for attractively valued companies with strong earnings growth potential.
That missi… [+2383 chars]",-0.584,negative,0.584,1.58,-0.925,https://finance.yahoo.com/news/2-charts-show-why-magnificent-7-stocks-are-being-loved-again-151105348.html,2026-04-21 20:15:37,2026-04-21
b64d9d2765700e3a,AAPL,Apple,2026-04-20,Wccftech,newsapi,"One Analyst Breaks From The Herd, Says Apple’s DRAM Buying Spree Won’t Crush Margins Despite 2.4 Exabyte Appetite","One Analyst Breaks From The Herd, Says Apple’s DRAM Buying Spree Won’t Crush Margins Despite 2.4 Exabyte Appetite. When multiple analysts cite various supply chain sources to assert that Apple is apparently buying up all the DRAM it can get its hands on, you should pay attention.
And now, Goldman S...",0.0,neutral,0.44,1.58,0.0,https://wccftech.com/goldman-sachs-breaks-from-wall-street-panic-says-apples-dram-hoarding-wont-crush-margins-despite-2-4-exabyte-appetite/,2026-04-21 20:15:37,2026-04-21
fa9f8ed23a1aa9ef,AAPL,Apple,2026-04-20,Motley Fool Australia,newsapi,3 ASX ETFs to build a portfolio around in 2026,"3 ASX ETFs to build a portfolio around in 2026. Building a portfolio in 2026 does not need to start with dozens of positions.
In many cases, a small number of well-chosen exchange traded funds (ETFs) can do most of the heavy lifting. The trick is… [+2399 chars]",0.0,neutral,0.921,1.58,0.0,https://www.fool.com.au/2026/04/20/3-asx-etfs-to-build-a-portfolio-around-in-2026/,2026-04-21 20:15:37,2026-04-21
