article_id,symbol,company,date_publication,source,api_source,titre,contenu,score_sentiment,sentiment,confiance,poids,score_pondere,url,date_analyse,ajout_date
a105e3bae2d9eee5,GOOGL,Google,2026-04-13,Pypi.org,newsapi,sibyl-research added to PyPI,"sibyl-research added to PyPI. AI-powered deep research agent. Ask any question Sibyl searches the web across multiple sources, reads dozens of pages, cross-references findings, and generates an executive-quality research report w… [+6508 chars]",0.0,neutral,0.938,1.3,0.0,https://pypi.org/project/sibyl-research/,2026-04-16 10:26:50,2026-04-16
74eb273253459e78,GOOGL,Google,2026-04-14,Yahoo Entertainment,newsapi,"Jim Cramer Says “Don’t Mess With Alphabet, They’re Crushing It”","Jim Cramer Says “Don’t Mess With Alphabet, They’re Crushing It”. Alphabet Inc. (NASDAQ:GOOGL) is among Jim Cramers recent stock calls as he urged investors to stand by the defense sector. A club member asked whether their portfolio is diverse enough if their top 5… [+1910 chars]",0.0,neutral,0.881,1.58,0.0,https://finance.yahoo.com/markets/stocks/articles/jim-cramer-says-don-t-181431909.html,2026-04-16 10:26:50,2026-04-16
143e9fa1fe50dc45,GOOGL,Google,2026-04-13,Yahoo Entertainment,newsapi,"As Waymo Launches in Nashville, Should You Buy, Sell, or Hold GOOGL Stock?","As Waymo Launches in Nashville, Should You Buy, Sell, or Hold GOOGL Stock?. If you click 'Accept all', we and our partners, including 251 who are part of the IAB Transparency &amp; Consent Framework, will also store and / or access information on a device (in other words, us… [+1046 chars]",0.0,neutral,0.948,1.08,0.0,https://consent.yahoo.com/v2/collectConsent?sessionId=1_cc-session_185943b0-4d30-451d-ac6c-3e1e4db18cab,2026-04-16 10:26:50,2026-04-16
f7c974420620290a,AMZN,Amazon,2026-04-14,Reading Eagle,gnews,Amazon’s $11.6 billion Globalstar deal amps up rivalry with Musk,"Amazon’s $11.6 billion Globalstar deal amps up rivalry with Musk. For information on submitting an obituary, please contact Reading Eagle by phone at 610-371-5018, or email at obituaries@readingeagle.com or fax at 610-371-5193.
Most obituaries published in the Reading Eagle are submitted through fun...",0.0,neutral,0.933,1.32,0.0,https://www.readingeagle.com/2026/04/14/amazon-buys-globalstar-battles-musk-starlink-satellite/,2026-04-16 10:26:53,2026-04-16
c761f5262906319f,AMZN,Amazon,2026-04-13,Seeking Alpha,gnews,The Market May Be Misreading Amazon’s AI Position (NASDAQ:AMZN),"The Market May Be Misreading Amazon’s AI Position (NASDAQ:AMZN). Analyst’s Disclosure: I/we have no stock, option or similar derivative position in any of the companies mentioned, and no plans to initiate any such positions within the next 72 hours. I wrote this article myself, and it expresses my o...",0.0,neutral,0.886,1.08,0.0,https://seekingalpha.com/article/4890292-the-market-may-be-misreading-amazon-ai-position,2026-04-16 10:26:53,2026-04-16
40b3061d05ee90bc,AMZN,Amazon,2026-04-14,Yahoo Entertainment,newsapi,"Amazon.com, Inc. (AMZN) Cloud Unit AWS Inks Deals with Uber and Coupa","Amazon.com, Inc. (AMZN) Cloud Unit AWS Inks Deals with Uber and Coupa. Amazon.com, Inc. (NASDAQ:AMZN) is one of the top growth stocks in billionaire Philippe Laffonts portfolio. On April 7, Amazon.com, Inc. (NASDAQ:AMZN)s cloud unit, Amazon Web Services, entered into a … [+1862 chars]",0.0,neutral,0.528,1.58,0.0,https://finance.yahoo.com/markets/stocks/articles/amazon-com-inc-amzn-cloud-114434964.html,2026-04-16 10:26:53,2026-04-16
18e9cf8e5f461c51,AMZN,Amazon,2026-04-14,Yahoo Entertainment,newsapi,"Should You Buy, Sell or Hold Amazon (AMZN) Stock at $245?","Should You Buy, Sell or Hold Amazon (AMZN) Stock at $245?. If you click 'Accept all', we and our partners, including 251 who are part of the IAB Transparency &amp; Consent Framework, will also store and / or access information on a device (in other words, us… [+1046 chars]",0.0,neutral,0.947,1.32,0.0,https://consent.yahoo.com/v2/collectConsent?sessionId=1_cc-session_67e58ace-d73f-43d4-865e-05bc9570d51b,2026-04-16 10:26:53,2026-04-16
720aa0cfcec18eb5,AMZN,Amazon,2026-04-14,Barchart.com,newsapi,"Heavy, Unusual Volume in Amazon Options Ahead of Earnings in Two Weeks","Heavy, Unusual Volume in Amazon Options Ahead of Earnings in Two Weeks. A Barchart report today shows huge, unusual volume in Amazon Inc. (AMZN) options ahead of its earnings due out at the end of the month. Investors are piling into AMZN stock ahead of earnings, as well… [+3951 chars]",0.0,neutral,0.746,1.58,0.0,https://www.barchart.com/story/news/1302168/heavy-unusual-volume-in-amazon-options-ahead-of-earnings-in-two-weeks,2026-04-16 10:26:53,2026-04-16
47f5fffff1b84924,AMZN,Amazon,2026-04-14,Investing.com,gnews,Amazon Stock Surges 20%: Can the Rally Survive Earnings?,"Amazon Stock Surges 20%: Can the Rally Survive Earnings?. After months of frustration, is finally showing signs of life. Shares of the tech giant are currently trading around $240, up from $200 in the last week of March, marking a 20% rally in just a few weeks and the stock’s best run in months. Tha...",0.949,positive,0.949,1.32,1.252,https://www.investing.com/analysis/amazon-stock-surges-20-can-the-rally-survive-earnings-200678423,2026-04-16 10:26:53,2026-04-16
dac9c7daf1aea8d8,AMZN,Amazon,2026-04-14,Barchart.com,newsapi,Stocks Climb on US-Iran Peace Talk Optimism and a Favorable PPI Report,"Stocks Climb on US-Iran Peace Talk Optimism and a Favorable PPI Report. The S&amp;P 500 Index ($SPX) (SPY) today is up +0.39%, the Dow Jones Industrial Average ($DOWI) (DIA) is up +0.13%, and the Nasdaq 100 Index ($IUXX) (QQQ) is up +0.76%.  June E-mini S&amp;P futures (… [+6415 chars]",0.935,positive,0.935,1.58,1.48,https://www.barchart.com/story/news/1297803/stocks-climb-on-us-iran-peace-talk-optimism-and-a-favorable-ppi-report,2026-04-16 10:26:54,2026-04-16
00af0ce61ac4e6dc,AMZN,Amazon,2026-04-13,Barchart.com,newsapi,Jassy Is Selling the Amazon AI Story: Should You Buy AMZN Stock Here?,"Jassy Is Selling the Amazon AI Story: Should You Buy AMZN Stock Here?. Amazon (AMZN) released its 2025 annual shareholder letter on April 9. Among other things in the letter, CEO Andy Jassy was unapologetic about Amazon's burgeoning capex, which is set to hit a record h… [+4175 chars]",0.0,neutral,0.878,1.3,0.0,https://www.barchart.com/story/news/1280271/jassy-is-selling-the-amazon-ai-story-should-you-buy-amzn-stock-here,2026-04-16 10:26:54,2026-04-16
3f31ff9b504e9ceb,AMZN,Amazon,2026-04-14,The Boston Herald,gnews,Amazon’s $11.6 billion Globalstar deal amps up rivalry with Musk,"Amazon’s $11.6 billion Globalstar deal amps up rivalry with Musk. By Michelle F. Davis, Ryan Gould, Loren Grush, Matt Day and Bruce Einhorn, Bloomberg News
Amazon.com Inc.’s $11.6 billion deal to buy Globalstar Inc. ramps up competition with Elon Musk’s Starlink in satellite communications, a market...",0.89,positive,0.89,1.32,1.175,https://www.bostonherald.com/2026/04/14/amazon-buys-globalstar-battles-musk-starlink-satellite/,2026-04-16 10:26:54,2026-04-16
323ac7de6ccc3323,AMZN,Amazon,2026-04-14,St. Paul Pioneer Press,gnews,Amazon’s $11.6 billion Globalstar deal amps up rivalry with Musk,"Amazon’s $11.6 billion Globalstar deal amps up rivalry with Musk. To share the story of your loved one, you can submit an obituary using any of the following methods:
Email: Please include the information from our Obituary Checklist (referenced below) to obits@pioneerpress.com.
Online: Use our Self-...",0.0,neutral,0.951,1.32,0.0,https://www.twincities.com/2026/04/14/amazon-buys-globalstar-battles-musk-starlink-satellite/,2026-04-16 10:26:54,2026-04-16
0bab5d7da599bce2,AMZN,Amazon,2026-04-13,Yahoo Entertainment,newsapi,Amazon (AMZN): Top High-Flying AI Stock to Buy,"Amazon (AMZN): Top High-Flying AI Stock to Buy. If you click 'Accept all', we and our partners, including 251 who are part of the IAB Transparency &amp; Consent Framework, will also store and / or access information on a device (in other words, us… [+1046 chars]",0.0,neutral,0.931,1.08,0.0,https://consent.yahoo.com/v2/collectConsent?sessionId=1_cc-session_8b3c0403-9894-4ead-ae07-f87bf039d020,2026-04-16 10:26:54,2026-04-16
948baf9e98e7b4c5,AMZN,Amazon,2026-04-14,Norfolk Virginian-Pilot,gnews,Amazon’s $11.6 billion Globalstar deal amps up rivalry with Musk,"Amazon’s $11.6 billion Globalstar deal amps up rivalry with Musk. By Michelle F. Davis, Ryan Gould, Loren Grush, Matt Day and Bruce Einhorn, Bloomberg News
Amazon.com Inc.’s $11.6 billion deal to buy Globalstar Inc. ramps up competition with Elon Musk’s Starlink in satellite communications, a market...",0.89,positive,0.89,1.32,1.175,https://www.pilotonline.com/2026/04/14/amazon-buys-globalstar-battles-musk-starlink-satellite/,2026-04-16 10:26:54,2026-04-16
f7c05980ac0c891a,AMZN,Amazon,2026-04-13,24/7 Wall St.,newsapi,Amazon Price Prediction: Bull and Bear Case,"Amazon Price Prediction: Bull and Bear Case. <ul><li>Amazon (AMZN) reported Q4 2025 revenue of $213.39B (up 13.6% year-over-year) with AWS accelerating 24% in the quarter, its fastest growth in 13 quarters, while custom AI chips like Trainium g… [+5337 chars]",0.953,positive,0.953,1.3,1.235,https://247wallst.com/investing/2026/04/13/amazon-price-prediction-bull-and-bear-case/,2026-04-16 10:26:54,2026-04-16
0469fe9c952b2633,AMZN,Amazon,2026-04-14,Investor's Business Daily,gnews,"Dow Jones E-Commerce Giant Amazon, Alphabet Eye New Buy Points","Dow Jones E-Commerce Giant Amazon, Alphabet Eye New Buy Points. Information in Investor’s Business Daily is for informational and educational purposes only and should not be construed as an offer, recommendation, solicitation, or rating to buy or sell securities. The information has been obtained fr...",0.0,neutral,0.951,1.32,0.0,https://www.investors.com/stock-lists/stocks-near-a-buy-zone/dow-jones-amazon-amzn-stock-buy-point-google/,2026-04-16 10:26:54,2026-04-16
518a0fafa4881a98,AMZN,Amazon,2026-04-14,San Diego Union-Tribune,gnews,Amazon’s $11.6 billion Globalstar deal amps up rivalry with Musk,"Amazon’s $11.6 billion Globalstar deal amps up rivalry with Musk. By Michelle F. Davis, Ryan Gould, Loren Grush, Matt Day and Bruce Einhorn, Bloomberg News
Amazon.com Inc.’s $11.6 billion deal to buy Globalstar Inc. ramps up competition with Elon Musk’s Starlink in satellite communications, a market...",0.89,positive,0.89,1.32,1.175,https://www.sandiegouniontribune.com/2026/04/14/amazon-buys-globalstar-battles-musk-starlink-satellite/,2026-04-16 10:26:54,2026-04-16
218353e44f202ea7,AMZN,Amazon,2026-04-13,Yahoo Entertainment,newsapi,"Stock market today: Dow, S&P 500, Nasdaq trim losses after Trump orders Hormuz blockade against Iran","Stock market today: Dow, S&P 500, Nasdaq trim losses after Trump orders Hormuz blockade against Iran. US stocks were mixed on Monday after President Trump ordered a US blockade of the Strait of Hormuz following the collapse of US-Iran negotiations.
The Dow Jones Industrial Average (^DJI) led the re...",-0.93,negative,0.93,1.3,-1.205,https://finance.yahoo.com/news/live/stock-market-today-dow-sp-500-nasdaq-trim-losses-after-trump-orders-hormuz-blockade-against-iran-142624712.html,2026-04-16 10:26:54,2026-04-16
7eea4551e7e4b43b,META,Meta,2026-04-14,Business Insider,newsapi,The Midwest's rise to America's second-biggest data center hub is fueled by these key states,"The Midwest's rise to America's second-biggest data center hub is fueled by these key states. Construction for a Meta data center campus is underway in Beaver Dam, Wisconsin.Joe Timmerman/Wisconsin Watch via Getty Images
<ul><li>Northern Virginia has long been the center of the data center i… [+216...",0.0,neutral,0.719,1.3,0.0,https://www.businessinsider.com/midwest-texas-see-boom-in-data-center-development-2026-4,2026-04-16 10:26:57,2026-04-16
f4b1c998fb7d655c,META,Meta,2026-04-14,Slashdot.org,newsapi,"Audit Finds Google, Microsoft, and Meta Still Tracking Users After Opt-Out","Audit Finds Google, Microsoft, and Meta Still Tracking Users After Opt-Out. An independent privacy audit of Microsoft, Meta, and Google web traffic in California found that the companies may be violating state regulations and racking up billions in fines. According to the au… [+2063 chars]",-0.933,negative,0.933,1.58,-1.478,https://tech.slashdot.org/story/26/04/14/1955224/audit-finds-google-microsoft-and-meta-still-tracking-users-after-opt-out,2026-04-16 10:26:57,2026-04-16
03997436c0eded25,META,Meta,2026-04-14,Business Insider,newsapi,"He managed 120 people at Meta. Now, he's walking away from Big Tech to join Lovable — here's why.","He managed 120 people at Meta. Now, he's walking away from Big Tech to join Lovable — here's why.. Patrik Torstensson.Courtesy of Lovable
<ul><li>A Meta engineering director left Big Tech after feeling like more of ""a passenger than a driver.""</li><li>He joined AI startup Lovable, drawn by speed … ...",0.0,neutral,0.798,1.58,0.0,https://www.businessinsider.com/meta-director-quits-big-tech-for-fast-growing-ai-startup-lovable-2026-4,2026-04-16 10:26:57,2026-04-16
9021bd9b6a8a2849,META,Meta,2026-04-15,The Economic Times,gnews,Nasdaq Live: US stocks future hold steady with earnings in focus - The Economic Times,"Nasdaq Live: US stocks future hold steady with earnings in focus - The Economic Times. Oil prices remained elevated, staying well above pre-war levels, while the IMF lowered global growth projections due to energy-driven inflation risks. Analysts warned equity markets may be underpricing downside ri...",-0.813,negative,0.813,1.56,-1.268,https://economictimes.indiatimes.com/markets/us-stocks/news/us-stock-market-live-dow-jones-sp-500-nasdaq-trump-iran-war-blockade-talks-brent-crude-oil-bank-corporate-earnings-stock-price-news/liveblog/130283559.cms,2026-04-16 10:26:57,2026-04-16
c498b497b68483f9,META,Meta,2026-04-15,Business Insider,newsapi,"Utilities are spending $1.4 trillion to power the AI boom, and it's hiking up electric bills across the US","Utilities are spending $1.4 trillion to power the AI boom, and it's hiking up electric bills across the US. An Entergy power plant in Texas.Bloomberg/Getty Images
<ul><li>Utilities plan to spend $1.4 trillion on capital expenditures by 2030, a PowerLines study found.</li><li>The electricity demands...",0.0,neutral,0.676,1.58,0.0,https://www.businessinsider.com/utilities-plan-1-4-trillion-capex-ai-demands-2030-2026-4,2026-04-16 10:26:57,2026-04-16
c44df4f7873cf908,META,Meta,2026-04-14,Gizmodo.com,newsapi,Circle CEO Addresses Lack of Stablecoin Freezes During Crypto Thefts,"Circle CEO Addresses Lack of Stablecoin Freezes During Crypto Thefts. Circle CEO Jeremy Allaire indirectly addressed criticism over the stablecoin issuers handling of crypto thefts during a press conference in Seoul, according to a report in CoinDesk. He stated that Ci… [+5460 chars]",-0.93,negative,0.93,1.3,-1.205,https://gizmodo.com/circle-ceo-addresses-lack-of-stablecoin-freezes-during-crypto-thefts-2000745968,2026-04-16 10:26:57,2026-04-16
577aec64abd3b36c,META,Meta,2026-04-13,Business Insider,newsapi,"A Netflix accessory app keeps hitting No. 1 in the App Store, beating out ChatGPT","A Netflix accessory app keeps hitting No. 1 in the App Store, beating out ChatGPT. Netflix Game Controller led the free apps chart on Monday.Illustration by Thiago Prudencio/SOPA Images/LightRocket via Getty Images
<ul><li>Netflix Game Controller is No. 1 in the App Store, and has… [+3055 chars]",0.646,positive,0.646,1.3,0.838,https://www.businessinsider.com/netflix-game-controller-tops-apple-app-store-chatgpt-2026-4,2026-04-16 10:26:57,2026-04-16
a0f0c81c37911008,META,Meta,2026-04-13,Barchart.com,newsapi,A $21 Billion Reason to Buy CoreWeave Stock Now,"A $21 Billion Reason to Buy CoreWeave Stock Now. Coreweave (CRWV) just announced a $21 billion long-term agreement with Meta Platforms (META), offering its AI cloud capacity to the company through December 2032. The company had already had an exist… [+3777 chars]",0.763,positive,0.763,1.3,0.989,https://www.barchart.com/story/news/1281201/a-21-billion-reason-to-buy-coreweave-stock-now,2026-04-16 10:26:57,2026-04-16
41266a41988dbd82,META,Meta,2026-04-13,Gizmodo.com,newsapi,Claude Mythos Preview Has Officially Frightened the British,"Claude Mythos Preview Has Officially Frightened the British. High-ranking members of Britain’s government and banking sector are reportedly scrambling to figure out what to do about cybersecurity holes found by Claude Mythos Preview, Anthropics new automated s… [+2905 chars]",-0.582,negative,0.582,1.3,-0.754,https://gizmodo.com/claude-mythos-preview-has-officially-frightened-the-british-2000745462,2026-04-16 10:26:57,2026-04-16
2fd312bff8ce7c61,AAPL,Apple,2026-04-15,Yahoo Entertainment,newsapi,VOO vs. QQQ vs. SPY — Which ETF Is the Best Buy Right Now?,"VOO vs. QQQ vs. SPY — Which ETF Is the Best Buy Right Now?. When it comes to investing in the broader U.S. market, ETFs like Vanguard S&amp;P 500 ETF (VOO) from Vanguard, the SPDR S&amp;P 500 ETF Trust (SPY) from State Street, and Invesco QQQ Trust (QQQ) from… [+1806 chars]",0.0,neutral,0.895,1.58,0.0,https://finance.yahoo.com/markets/stocks/articles/voo-vs-qqq-vs-spy-104138064.html,2026-04-16 20:09:04,2026-04-16
2f27b7432466e8b4,AAPL,Apple,2026-04-15,Yahoo Entertainment,newsapi,Top BofA Analyst Raises Apple Stock (AAPL) Price Target Ahead of Q2 Earnings,"Top BofA Analyst Raises Apple Stock (AAPL) Price Target Ahead of Q2 Earnings. If you click 'Accept all', we and our partners, including 251 who are part of the IAB Transparency &amp; Consent Framework, will also store and / or access information on a device (in other words, us… [+1046 chars]",0.0,neutral,0.93,1.32,0.0,https://consent.yahoo.com/v2/collectConsent?sessionId=1_cc-session_3ab2b142-58e0-4908-b1fc-62b22f438f71,2026-04-16 20:09:05,2026-04-16
beae84d0eee2bf3c,AAPL,Apple,2026-04-15,Yahoo Entertainment,newsapi,"Apple (AAPL) Stock at $260: Buy, Sell or Hold?","Apple (AAPL) Stock at $260: Buy, Sell or Hold?. If you click 'Accept all', we and our partners, including 251 who are part of the IAB Transparency &amp; Consent Framework, will also store and / or access information on a device (in other words, us… [+1046 chars]",0.0,neutral,0.949,1.32,0.0,https://consent.yahoo.com/v2/collectConsent?sessionId=1_cc-session_358f8668-a476-40ec-b4cc-251419d36562,2026-04-16 20:09:05,2026-04-16
8f716a10318bf702,AAPL,Apple,2026-04-15,Business Insider,newsapi,"Long Elon, short Jensen: A research firm says retail traders are flocking back to Tesla and pivoting from Nvidia","Long Elon, short Jensen: A research firm says retail traders are flocking back to Tesla and pivoting from Nvidia. Retail traders are flocking back to an old favorite. 
According to data from Vanda Research, which tracks retail investor flows into stocks and ETFs, Tesla is seeing a renewed buying sp...",0.893,positive,0.893,1.58,1.415,https://www.businessinsider.com/tesla-stock-nvidia-elon-musk-tsla-nvda-retail-traders-2026-4,2026-04-16 20:09:05,2026-04-16
6841fe754bb142b4,AAPL,Apple,2026-04-15,Motley Fool Australia,newsapi,3 ASX ETFs to buy and hold for the next decade,"3 ASX ETFs to buy and hold for the next decade. If you are investing with a long time horizon, simplicity often wins.
Rather than constantly adjusting your portfolio or chasing short-term opportunities, a small number of well-chosen exchange trad… [+2359 chars]",0.0,neutral,0.903,1.58,0.0,https://www.fool.com.au/2026/04/15/3-asx-etfs-id-buy-and-hold-for-the-next-decade/,2026-04-16 20:09:05,2026-04-16
8f716a10318bf702,MSFT,Microsoft,2026-04-15,Business Insider,newsapi,"Long Elon, short Jensen: A research firm says retail traders are flocking back to Tesla and pivoting from Nvidia","Long Elon, short Jensen: A research firm says retail traders are flocking back to Tesla and pivoting from Nvidia. Retail traders are flocking back to an old favorite. 
According to data from Vanda Research, which tracks retail investor flows into stocks and ETFs, Tesla is seeing a renewed buying sp...",0.893,positive,0.893,1.58,1.415,https://www.businessinsider.com/tesla-stock-nvidia-elon-musk-tsla-nvda-retail-traders-2026-4,2026-04-16 20:09:08,2026-04-16
2fd312bff8ce7c61,MSFT,Microsoft,2026-04-15,Yahoo Entertainment,newsapi,VOO vs. QQQ vs. SPY — Which ETF Is the Best Buy Right Now?,"VOO vs. QQQ vs. SPY — Which ETF Is the Best Buy Right Now?. When it comes to investing in the broader U.S. market, ETFs like Vanguard S&amp;P 500 ETF (VOO) from Vanguard, the SPDR S&amp;P 500 ETF Trust (SPY) from State Street, and Invesco QQQ Trust (QQQ) from… [+1806 chars]",0.0,neutral,0.895,1.58,0.0,https://finance.yahoo.com/markets/stocks/articles/voo-vs-qqq-vs-spy-104138064.html,2026-04-16 20:09:08,2026-04-16
2aa63c5ff7f676a2,TSLA,Tesla,2026-04-15,Yahoo Entertainment,newsapi,Tesla Inc. (TSLA) Stock Outlook Reflects Changing Investor Appetite,"Tesla Inc. (TSLA) Stock Outlook Reflects Changing Investor Appetite. If you click 'Accept all', we and our partners, including 251 who are part of the IAB Transparency &amp; Consent Framework, will also store and / or access information on a device (in other words, us… [+1046 chars]",0.0,neutral,0.934,1.32,0.0,https://consent.yahoo.com/v2/collectConsent?sessionId=1_cc-session_41a82220-7ab3-48e0-b5b6-f85f30707cd2,2026-04-16 20:09:11,2026-04-16
15ce9e8e1573b25d,TSLA,Tesla,2026-04-15,TheStreet,newsapi,Cathie Wood’s Ark keeps selling one stock once again,"Cathie Wood’s Ark keeps selling one stock once again. Cathie Wood, head of Ark Investment Management, is known for making bold, conviction-driven bets, but shes just as quick to trim positions when the strategy shifts. That pattern is playing out again … [+4509 chars]",0.0,neutral,0.791,1.58,0.0,https://www.thestreet.com/investing/stocks/cathie-woods-ark-keeps-selling-one-stock-again-this-week,2026-04-16 20:09:11,2026-04-16
b32283e7b0eb218d,GOOGL,Google,2026-04-15,24/7 Wall St.,newsapi,It’s Wednesday. Do You Own Enough Google?,"It’s Wednesday. Do You Own Enough Google?. <ul><li>Google (GOOGL) generated $400B in annual revenue for the first time in fiscal 2025 with net income of $132.17B, up 32% year over year, while expanding AI infrastructure through a long-term TP… [+4606 chars]",0.952,positive,0.952,1.58,1.508,https://247wallst.com/investing/2026/04/15/its-wednesday-do-you-own-enough-google/,2026-04-16 20:09:18,2026-04-16
cacf1d1486960794,AMZN,Amazon,2026-04-15,Yahoo Entertainment,newsapi,Commentary: FedEx and UPS need to move up the e-commerce food chain,"Commentary: FedEx and UPS need to move up the e-commerce food chain. By Satish Jindel
The Big Three legacy parcel carriers FedEx, UPS and the U.S. Postal Service are under pressure like never before as their largest retail customers build out residential delivery net… [+5755 chars]",-0.858,negative,0.858,1.58,-1.359,https://finance.yahoo.com/news/commentary-fedex-ups-move-e-141751961.html,2026-04-16 20:09:22,2026-04-16
277f4ec2acc7ff30,AMZN,Amazon,2026-04-14,Santa Rosa Press Democrat,gnews,Amazon’s $11.6 billion Globalstar deal amps up rivalry with Musk,"Amazon’s $11.6 billion Globalstar deal amps up rivalry with Musk. By Michelle F. Davis, Ryan Gould, Loren Grush, Matt Day and Bruce Einhorn, Bloomberg News
Amazon.com Inc.’s $11.6 billion deal to buy Globalstar Inc. ramps up competition with Elon Musk’s Starlink in satellite communications, a market...",0.89,positive,0.89,1.32,1.175,https://www.pressdemocrat.com/2026/04/14/amazon-buys-globalstar-battles-musk-starlink-satellite/,2026-04-16 20:09:22,2026-04-16
8a165baf7753ad34,META,Meta,2026-04-15,Gizmodo.com,newsapi,Apple’s Smart Glasses Are Stepping Into a Privacy Minefield,"Apple’s Smart Glasses Are Stepping Into a Privacy Minefield. Smart glasses are attracting some big names. There’s Meta, of course, which is already well out ahead of the pack with several pairs for sale, but there’s also Samsung and Google waiting in the wings… [+5539 chars]",0.0,neutral,0.686,1.58,0.0,https://gizmodo.com/apples-smart-glasses-are-stepping-into-a-privacy-minefield-2000746809,2026-04-16 20:09:26,2026-04-16
7aa25cee3094edfc,META,Meta,2026-04-15,Wired,newsapi,AI Could Democratize One of Tech's Most Valuable Resources,"AI Could Democratize One of Tech's Most Valuable Resources. Nvidia is the undisputed king of AI chips. But thanks to the AI it helped build, the champ could soon face growing competition.
Modern AI runs on Nvidia designs, a dynamic that has propelled the com… [+3700 chars]",0.0,neutral,0.714,1.58,0.0,https://www.wired.com/story/ai-could-democratize-one-of-techs-most-valuable-resources/,2026-04-16 20:09:26,2026-04-16
ff22fc1afdbb109d,AAPL,Apple,2026-04-16,Yahoo Entertainment,newsapi,Taiwan Semiconductor CEO just dropped a hint about the next move in AI stocks,"Taiwan Semiconductor CEO just dropped a hint about the next move in AI stocks. Taiwan Semiconductor (TSM) just dropped an important clue that should excite the resurgent AI stock bulls.
""AI-related demand continued to be extremely robust,"" Taiwan Semiconductor CEO C.C. Wei tol… [+2651 chars]",0.919,positive,0.919,1.58,1.455,https://finance.yahoo.com/news/taiwan-semiconductor-ceo-just-dropped-a-hint-about-the-next-move-in-ai-stocks-120227431.html,2026-04-17 20:06:34,2026-04-17
683b11bf219425fa,AAPL,Apple,2026-04-15,Barchart.com,newsapi,Amazon Stock Is Overbought Amid Globalstar Deal. Is a Pullback Coming?,"Amazon Stock Is Overbought Amid Globalstar Deal. Is a Pullback Coming?. Amazon (AMZN) shares rallied on April 14 after the tech titan announced a definitive $11.6 billion agreement to acquire Covington-headquartered satellite connectivity firm Globalstar (GSAT).
The bul… [+1901 chars]",0.874,positive,0.874,1.3,1.133,https://www.barchart.com/story/news/1316564/amazon-stock-is-overbought-amid-globalstar-deal-is-a-pullback-coming,2026-04-17 20:06:34,2026-04-17
