article_id,symbol,company,date_publication,source,api_source,titre,contenu,score_sentiment,sentiment,confiance,poids,score_pondere,url,date_analyse,ajout_date,query_used
c5b6836f88cbb32f,GOOGL,Google,2026-05-04,MarketBeat,newsapi,5 Mega-Cap Stocks That Beat Q1 2026 Earnings and Are Still Climbing,"5 Mega-Cap Stocks That Beat Q1 2026 Earnings and Are Still Climbing. Conceptual illustration of a digital cloud connected to a city skyline by glowing data streams.
Key Points
<ul><li>Alphabet, Amazon, Apple, Qualcomm, and Caterpillar all reported Q1 2026 earnings b… [+8923 chars]",0.0,neutral,0.792,1.3,0.0,https://www.marketbeat.com/originals/5-mega-cap-stocks-that-beat-q1-2026-earnings-and-are-still-climbing/?utm_source=yahoofinance&amp;utm_medium=yahoofinance,2026-05-06 20:34:54,2026-05-06,
ebabdc293d23a4c7,GOOGL,Google,2026-05-05,24/7 Wall St.,newsapi,Alphabet Stock: I See a Path to $500 by 2027,"Alphabet Stock: I See a Path to $500 by 2027. Quick Read
<ul><li>Google (GOOGL) beat Q1 earnings with $109.9B in revenue (up 22% YoY) and $5.11 EPS versus $2.63 consensus, while Google Cloud surged 63% to $20B with a backlog nearly doubling to … [+4683 chars]",0.949,positive,0.949,1.58,1.503,https://247wallst.com/investing/2026/05/05/alphabet-stock-i-see-a-path-to-500-by-2027/,2026-05-06 20:34:54,2026-05-06,
04297d9ef753333e,GOOGL,Google,2026-04-30 11:36,Devdiscourse,gnews,Stocks Surge as Tech Giants Outshine Inflation Fears,"Stocks Surge as Tech Giants Outshine Inflation Fears. U.S. stock index futures experienced a rise on Thursday, bouncing back from earlier caution as investors evaluated the strength of corporate earnings against inflation concerns heightened by rising oil prices.
The market's volatility reflects an unde... [827 chars]",0.9155,positive,0.9155,1.08,0.9888,https://www.devdiscourse.com/article/headlines/3892027-stocks-surge-as-tech-giants-outshine-inflation-fears,2026-05-07 08:30:25,2026-05-07,Google
67618c7bfd756a3d,GOOGL,Google,2026-05-01 09:31,The Atlanta Journal-Constitution,gnews,"World shares are mixed with most markets closed for May Day, while oil holds steady at $111 a barrel","World shares are mixed with most markets closed for May Day, while oil holds steady at $111 a barrel. World shares were mixed and U.S. futures edged higher Friday, with most markets closed for May Day holidays.
Brent crude’s price rose 83 cents to $111.23 per barrel while U.S. benchmark crude added 12 cents to $105.19 a barrel.
lliw aw ot keew-eerht ... [632 chars]",0.9036,positive,0.9036,1.08,0.9759,https://www.ajc.com/news/2026/05/world-shares-are-mixed-with-most-markets-closed-for-may-day-while-oil-holds-steady-at-111-a-barrel/,2026-05-07 08:30:26,2026-05-07,Google
9738840f8d49ab6b,GOOGL,Google,2026-04-29 21:26,Hindustan Times,gnews,"Stock market today: What Google, Microsoft, Meta and Amazon earnings reports say. Explained","Stock market today: What Google, Microsoft, Meta and Amazon earnings reports say. Explained. CEO Sundar Pichai said Alphabet’s AI investments “are lighting up every part of the business.”
That performance helped fuel a more than 6% after-hours stock jump, with investors rewarding both monetization and scale.
“The significant reacceleration i... [1929 chars]",0.8871,positive,0.8871,1.08,0.958,https://www.hindustantimes.com/world-news/us-news/stock-market-today-what-google-alphabet-microsoft-meta-facebook-amazon-qualcomm-earnings-reports-say-explained-101777497071990.html,2026-05-07 08:30:26,2026-05-07,Google
57036ddf43f6c9e2,GOOGL,Google,2026-04-30 16:04,Devdiscourse,gnews,Oil Market Turbulence Amid Strong Corporate Profits: A Stock Market Overview,"Oil Market Turbulence Amid Strong Corporate Profits: A Stock Market Overview. Oil prices saw significant fluctuations on Thursday, initially soaring to their highest levels since the conflict with Iran began, before quickly retreating. Concurrently, the US stock market exhibited upward momentum, buoyed by robust profit reports... [1241 chars]",0.9463,positive,0.9463,1.08,1.022,https://www.devdiscourse.com/article/business/3892564-oil-market-turbulence-amid-strong-corporate-profits-a-stock-market-overview,2026-05-07 08:30:30,2026-05-07,Alphabet
429aa91053ff0ec5,GOOGL,Google,2026-04-30 20:14,WTOP,gnews,"US stocks rally to the finish of their best month since 2020, even as oil prices whipsaw","US stocks rally to the finish of their best month since 2020, even as oil prices whipsaw. NEW YORK (AP) — The U.S stock market motored to more records Thursday as profits keep piling up for Alphabet, Caterpillar and other big businesses. The gains came after the latest whipsaw moves for oil prices, which surged toward their highest levels... [4706 chars]",0.9092,positive,0.9092,1.08,0.982,https://wtop.com/world/2026/04/brent-crude-tops-125-a-barrel-on-iran-war-worries-while-world-stocks-retreat/,2026-05-07 08:30:30,2026-05-07,Alphabet
d107e5c8349c91a3,GOOGL,Google,2026-05-04 11:31,Barchart,gnews,Alphabet Stock: Analyst Estimates & Ratings,"Alphabet Stock: Analyst Estimates & Ratings. With a market cap of around $4.6 trillion, Alphabet Inc. (GOOG) is a global technology conglomerate and the parent company of Google, headquartered in Mountain View, California. Formed in 2015 as part of a corporate restructuring, it operates across ... [2706 chars]",0.0,neutral,0.9351,1.08,0.0,https://www.barchart.com/story/news/1681612/alphabet-stock-analyst-estimates-ratings,2026-05-07 08:30:30,2026-05-07,Alphabet
b590eedd473959ca,GOOGL,Google,2026-04-30 21:51,Los Angeles Times,gnews,U.S. stocks rally to the finish of their best month since 2020,"U.S. stocks rally to the finish of their best month since 2020. The U.S stock market motored to more records Thursday as profits keep piling up for Alphabet, Caterpillar and other big businesses. The gains came after the latest whipsaw moves for oil prices, which surged toward their highest levels since the war w... [4476 chars]",0.8328,positive,0.8328,1.08,0.8994,https://www.latimes.com/business/story/2026-04-30/u-s-stocks-rally-to-finish-of-their-best-month-since-2020,2026-05-07 08:30:31,2026-05-07,Alphabet
25a6b7468cd59d13,GOOGL,Google,2026-05-04 13:05,CNBC,gnews,Jim Cramer's top 10 things to watch in the stock market Monday,"Jim Cramer's top 10 things to watch in the stock market Monday. My top 10 things to watch Monday, May 4 1. Oil prices jumped after conflicting media reports of an Iranian attack on a U.S. warship sparked more concerns about instability in the region, pushing the S & P 500 lower. It follows a blockbuster week for ... [4264 chars]",-0.909,negative,0.909,1.62,-1.4726,https://www.cnbc.com/2026/05/04/jim-cramers-top-10-things-to-watch-in-the-stock-market-monday.html,2026-05-07 08:30:31,2026-05-07,Alphabet
d319f1183c0b2c36,GOOGL,Google,2026-04-30 18:31,Devdiscourse,gnews,U.S. Stock Surge: S&P 500 and Nasdaq Eye Historic Gains Amid Earnings Win,"U.S. Stock Surge: S&P 500 and Nasdaq Eye Historic Gains Amid Earnings Win. U.S. stocks made a significant upward move on Thursday, with the S&P 500 and Nasdaq poised for their largest monthly gains in years, buoyed by strong corporate earnings. This bullish sentiment helped investors overlook a geopolitical-induced oil supp... [797 chars]",0.9206,positive,0.9206,1.08,0.9942,https://www.devdiscourse.com/article/headlines/3892771-us-stock-surge-sp-500-and-nasdaq-eye-historic-gains-amid-earnings-win,2026-05-07 08:30:31,2026-05-07,Alphabet
2ae5749ea962a447,GOOGL,Google,2026-05-01 06:55,Arkansas Online,gnews,US stocks end best month since ’20,"US stocks end best month since ’20. NEW YORK -- The U.S stock market motored to more records Thursday as profits keep piling up for Alphabet, Caterpillar and other big businesses. The gains came after the latest whipsaw moves for oil prices, which surged toward their highest levels sin... [4589 chars]",0.9111,positive,0.9111,1.08,0.984,https://www.arkansasonline.com/news/2026/may/01/us-stocks-end-best-month-since-20/,2026-05-07 08:30:31,2026-05-07,Alphabet
4f3446126e009664,GOOGL,Google,2026-04-07 14:46,Benzinga,gnews,Alphabet Stock Edges Higher Tuesday: What's Going On?,"Alphabet Stock Edges Higher Tuesday: What's Going On?. Alphabet stock is trading at elevated levels. What’s the outlook for GOOGL shares?
Lower-Cost AI Tools Could Help Deepen Developer Adoption
Alphabet's push to lower AI costs also follows last week's on-device AI rollout, with DeepMind's Gemma 4 model... [2282 chars]",0.8815,positive,0.8815,1.08,0.9521,https://www.benzinga.com/trading-ideas/movers/26/04/51682266/alphabet-stock-edges-higher-tuesday-whats-going-on,2026-05-07 08:30:34,2026-05-07,GOOGL
f6080efec9748881,GOOGL,Google,2026-04-07 05:14,Markets Insider,gnews,"Broadcom (AVGO) Stock Rises on Google, Anthropic Chip Deals","Broadcom (AVGO) Stock Rises on Google, Anthropic Chip Deals. Broadcom (AVGO) shares are up 3.5% in pre-market trading on announcing multiyear chip deals with Alphabet (GOOGL) and AI startup Anthropic. The chip giant will develop and supply custom TPUs (Tensor Processing Units) and networking components for Goo... [2161 chars]",0.9505,positive,0.9505,1.08,1.0265,https://markets.businessinsider.com/news/stocks/broadcom-avgo-stock-rises-on-google-anthropic-chip-deals-1035998657,2026-05-07 08:30:35,2026-05-07,GOOGL
d70fdc9640cb97c5,GOOGL,Google,2026-04-29 12:17,The Economic Times,gnews,"US Stock Market Live: US futures mixed ahead of Big Tech earnings, Fed meet - The Economic Times","US Stock Market Live: US futures mixed ahead of Big Tech earnings, Fed meet - The Economic Times. Federal Reserve Chair Jerome Powell's tenure as Fed chief ends on May 15, though his tenure as a member of the Washington-based Board of Governors runs until January 2028. Speaking in March, Powell said he would stay on the board until an ongoing inv... [1736 chars]",0.0,neutral,0.7083,1.08,0.0,https://economictimes.indiatimes.com/markets/us-stocks/news/fed-meeting-live-us-stock-market-today-dow-jones-nasdaq-sp-500-jerome-powell-fomc-meet-rate-cut-outlook-iran-israel-war-earnings-stock-news/liveblog/130607038.cms,2026-05-07 08:30:43,2026-05-07,Alphabet earnings
5619f198f5a7f013,GOOGL,Google,2026-04-29 11:15,The Economic Times,gnews,80 seconds of big tech earnings will decide stock market’s fate,"80 seconds of big tech earnings will decide stock market’s fate. Synopsis
Investors await earnings reports from Alphabet, Meta, and Microsoft after trading ends Wednesday. These tech giants' results will guide market sentiment. Focus will be on their artificial intelligence spending and revenue growth. Expectation... [7969 chars]",0.0,neutral,0.8953,1.08,0.0,https://economictimes.indiatimes.com/markets/us-stocks/news/80-seconds-of-big-tech-earnings-will-decide-stock-markets-fate/articleshow/130605173.cms,2026-05-07 08:30:43,2026-05-07,Alphabet earnings
3d01160154a3b31f,GOOGL,Google,2026-04-29 14:58,The Economic Times,gnews,"US stock market today: why Dow Jones crashing big while S&P 500 and Nasdaq are rising? Dow down by 200 points as oil surge, Fed jitters, and Big Tech earnings split market direction","US stock market today: why Dow Jones crashing big while S&P 500 and Nasdaq are rising? Dow down by 200 points as oil surge, Fed jitters, and Big Tech earnings split market direction. Synopsis
US stock market today: Why Dow Jones Industrial Average falls while S&P 500 and Nasdaq Composite hold steady? US stock market today shows a split. The Dow Jones drops nearly 200 points. The S&P 500 and Nasdaq Composite hold steady. This dive... [10343 chars]",-0.9609,negative,0.9609,1.08,-1.0378,https://economictimes.indiatimes.com/news/international/us/us-stock-market-today-why-dow-jones-crashing-big-while-sp-500-and-nasdaq-are-rising-dow-down-by-200-points-as-oil-surge-fed-jitters-and-big-tech-earnings-split-market-direction/articleshow/130610795.cms,2026-05-07 08:30:43,2026-05-07,Alphabet earnings
875f9e4db0832fb5,GOOGL,Google,2026-04-24 13:53,The Economic Times,gnews,US stock market concentration risk hits extreme levels: AI stocks surge to 45% of S&P 500 market cap in 2026— can $1.4 trillion AI-linked debt sustain this historic dominance?,"US stock market concentration risk hits extreme levels: AI stocks surge to 45% of S&P 500 market cap in 2026— can $1.4 trillion AI-linked debt sustain this historic dominance?. Synopsis
US stock market concentration risk hits extreme levels: AI stocks now dominate S&P 500 market cap at a record 45% level in 2026, reflecting a historic shift in US equity markets. Since the launch of ChatGPT, AI-linked companies have surged f... [9597 chars]",0.9136,positive,0.9136,1.08,0.9867,https://economictimes.indiatimes.com/news/international/us/us-stock-market-concentration-risk-hits-extreme-levels-ai-stocks-surge-to-45-of-sp-500-market-cap-in-2026-can-1-4-trillion-ai-linked-debt-sustain-this-historic-dominance/articleshow/130493020.cms,2026-05-07 08:30:43,2026-05-07,Alphabet earnings
9c9f9e84e263365e,GOOGL,Google,2026-04-30 13:13,CNBC,gnews,Jim Cramer's top 10 things to watch in the stock market Thursday,"Jim Cramer's top 10 things to watch in the stock market Thursday. My top 10 things to watch Thursday, April 30 1. Best of the earnings night for our big four hyperscalers: Alphabet . The call: world domination. Beats on search, subscriptions, and cloud — the company's three most consequential segments. Management b... [4670 chars]",0.0,neutral,0.9252,1.62,0.0,https://www.cnbc.com/2026/04/30/jim-cramers-top-10-things-to-watch-in-the-stock-market-thursday.html,2026-05-07 08:30:44,2026-05-07,Alphabet earnings
32c027380f784c4b,GOOGL,Google,2026-04-30 06:36,The Economic Times,gnews,US Stock Market | Alphabet shines bright on blockbuster earnings day,"US Stock Market | Alphabet shines bright on blockbuster earnings day. A crucial earnings session for Big Tech saw companies like Amazon, Microsoft, Meta, and Alphabet report their quarterly results. While most firms delivered solid performances, the market reaction differed widely, highlighting how investors are becomi... [2034 chars]",0.8143,positive,0.8143,1.08,0.8794,https://economictimes.indiatimes.com/markets/us-stocks/news/us-stock-market-alphabet-shines-bright-on-blockbuster-earnings-day/slideshow/130625739.cms,2026-05-07 08:30:44,2026-05-07,Alphabet earnings
98845082e88ef473,GOOGL,Google,2026-05-07 09:24,Finbold,gnews,Wall Street updates Google stock price for the next 12 months,"Wall Street updates Google stock price for the next 12 months. Ever since hitting the 2026 bottom at the end of March, Google (NASDAQ: GOOGL) stock has been on a decisive uptrend, rising a total of 45% within the timeframe and enjoying an especially pronounced upswing following the April 29 earnings report.
Mult... [1576 chars]",0.9433,positive,0.9433,1.32,1.2452,https://finbold.com/wall-street-updates-google-stock-price-for-the-next-12-months/,2026-05-08 20:09:19,2026-05-08,Google
200b79896ef1487e,GOOGL,Google,2026-05-10 13:46,Markets Insider,gnews,"Alphabet Stock Is Winning the AI Trade, but Anthropic Raises a New Risk for GOOGL","Alphabet Stock Is Winning the AI Trade, but Anthropic Raises a New Risk for GOOGL. Alphabet (GOOGL), the parent firm of Google, has been on a sharp run, and this week Alphabet even briefly passed Nvidia (NVDA) by market cap in after-hours trade. That marks a big shift for a firm that was once seen as at risk from the AI boom. Howev... [3328 chars]",0.8766,positive,0.8766,1.32,1.1571,https://markets.businessinsider.com/news/stocks/alphabet-stock-is-winning-the-ai-trade-but-anthropic-raises-a-new-risk-for-googl-1036134161,2026-05-11 20:32:02,2026-05-11,Google
e09bf75714e7abb7,GOOGL,Google,2026-05-12 04:44,The Economic Times,gnews,"US Stock Market: AI spending surge drives Alphabet, Amazon to tap global bond markets","US Stock Market: AI spending surge drives Alphabet, Amazon to tap global bond markets. Synopsis
Alphabet and Amazon are expanding their global borrowing to fund the escalating costs of the AI race. Alphabet plans its first yen-denominated bond sale, while Amazon will tap the Swiss franc market for the first time. These moves reflect th... [4264 chars]",0.5926,positive,0.5926,1.56,0.9244,https://economictimes.indiatimes.com/markets/us-stocks/news/us-stock-market-ai-spending-surge-drives-alphabet-amazon-to-tap-global-bond-markets/articleshow/131028581.cms,2026-05-12 20:31:19,2026-05-12,Alphabet
8edf8c61193922ba,GOOGL,Google,2026-05-11 13:13,MarketScreener,gnews,"Stock market concentration - a feature, not a bug: McGeever","Stock market concentration - a feature, not a bug: McGeever. ORLANDO, Florida, May 11 (Reuters) - As the artificial intelligence boom accelerates, stock market concentration is reaching historic proportions - and not just in the U.S. where tech megacaps like Nvidia and Alphabet dominate. Increasingly, top-heav... [5218 chars]",0.0,neutral,0.7749,1.32,0.0,https://www.marketscreener.com/news/stock-market-concentration-a-feature-not-a-bug-mcgeever-ce7f5bd9d98df323,2026-05-12 20:31:19,2026-05-12,Alphabet
c92d8efa1680788b,GOOGL,Google,2026-05-11 13:09,Reuters,gnews,"Stock market concentration - a feature, not a bug","Stock market concentration - a feature, not a bug. The rise of the ""Magnificent Seven"" U.S. tech ​giants has amplified equity market concentration. The top 10 U.S. stocks currently account for 33% of the overall market's value, according to Morgan Stanley analysts, and 37.5% of the MSCI ‌USA index.
S... [4362 chars]",0.0,neutral,0.8144,1.98,0.0,https://www.reuters.com/commentary/reuters-open-interest/stock-market-concentration-feature-not-bug-2026-05-11/,2026-05-12 20:31:19,2026-05-12,Alphabet
66dce0aae7319189,GOOGL,Google,2026-05-12 00:51,Moneycontrol,gnews,"We are witnessing history in stock market, that is not a good thing: Michael Burry warns of major Nasdaq reversal","We are witnessing history in stock market, that is not a good thing: Michael Burry warns of major Nasdaq reversal. Investor Michael Burry, best known for predicting the 2008 financial crisis and portrayed in The Big Short, has warned that the Nasdaq 100 could be headed for a sharp reversal after what he described as a “parabolic” rally in technology stocks.
In a ... [2677 chars]",-0.9325,negative,0.9325,1.56,-1.4546,https://www.moneycontrol.com/world/we-are-witnessing-history-in-stock-market-that-is-not-a-good-thing-michael-burry-warns-of-major-nasdaq-reversal-article-13915846.html,2026-05-12 20:31:20,2026-05-12,Alphabet
ba5b8fa096fed25c,GOOGL,Google,2026-05-12 16:00,The Star,gnews,"Stock market concentration - A feature, not a bug","Stock market concentration - A feature, not a bug. AS the artificial intelligence (AI) boom accelerates, stock market concentration is reaching historic proportions – and not just in the United States where tech megacaps like Nvidia and Alphabet dominate.
Increasingly, top-heavy indices are a feature... [4719 chars]",0.0,neutral,0.8965,1.32,0.0,https://www.thestar.com.my/business/insight/2026/05/13/stock-market-concentration---a-feature-not-a-bug,2026-05-13 20:32:48,2026-05-13,Alphabet
82c62e2f77e85013,GOOGL,Google,2026-05-15 11:00,Forbes,gnews,Is Google Stock The New Alpha?,"Is Google Stock The New Alpha?. Google (GOOGL) stock is currently trading close to $402. With an anticipated 2026 EPS of $14.22, the stock exhibits a forward P/E ratio of 28x. This ratio signifies a 35% premium over its historical five-year average forward P/E of 21x. In comparison... [3772 chars]",0.0,neutral,0.8075,1.08,0.0,https://www.forbes.com/sites/greatspeculations/2026/05/15/is-google-stock-the-new-alpha/,2026-05-18 20:26:00,2026-05-18,Google
824da5aa2fa74da2,GOOGL,Google,2026-05-17 14:06,CNBC,gnews,3 big things we're watching in the stock market for the week ahead,"3 big things we're watching in the stock market for the week ahead. Here we go again: Nvidia earnings week is upon us. The world's most valuable company and the leading maker of artificial intelligence chips will deliver first-quarter earnings on Wednesday night. Of course, it will drive a ton of the action on Wall S... [10292 chars]",0.0,neutral,0.6239,1.98,0.0,https://www.cnbc.com/2026/05/17/3-big-things-were-watching-in-the-stock-market-for-the-week-ahead.html,2026-05-18 20:26:01,2026-05-18,Google
1e922caec758d7df,GOOGL,Google,2026-05-18 22:21,CNBC,gnews,Alphabet's AI showcase is its chance to wow Wall Street,"Alphabet's AI showcase is its chance to wow Wall Street. Justin Sullivan | Getty Images
Alphabet 's stock is up 140% over the past year, with a cloud business that is growing faster than Amazon's and Microsoft's .
But 18 months ago, the Google parent looked like it had spent a decade preparing for the arti... [9551 chars]",0.8492,positive,0.8492,2.34,1.9872,https://www.cnbc.com/2026/05/18/google-i-o-alphabet-ai-wall-street.html,2026-05-19 20:31:31,2026-05-19,Google
33df2ad867fec953,GOOGL,Google,2026-05-19 10:20,Seeking Alpha,gnews,"AM Markets Need to Know: Meta layoffs, Samsung and union, and more","AM Markets Need to Know: Meta layoffs, Samsung and union, and more. AM Markets Need to Know: Meta layoffs, Samsung and union, and more
May 19, 2026, 6:20 AM ETS&P 500 Index (SP500)By : Sinchita Mitra, SA News Editor
Comments
Stock index futures slipped Tuesday, as Nasdaq futures bottomed the pack, with tech stocks co... [315 chars]",-0.9664,negative,0.9664,1.32,-1.2756,https://seekingalpha.com/news/4594735-am-markets-need-to-know-meta-layoffs-samsung-and-union-and-more,2026-05-20 21:02:14,2026-05-20,Google
a460fd73d6487315,GOOGL,Google,2026-05-19 16:02,Benzinga,gnews,What's Going On With Nebius Stock Tuesday?,"What's Going On With Nebius Stock Tuesday?. The sell-off appears to be driven by concerns about intensifying competition in the rapidly expanding AI cloud market rather than any immediate deterioration in underlying business fundamentals.
DA Davidson Initiates Coverage On Nebius
Separately, DA... [2447 chars]",-0.869,negative,0.869,1.32,-1.1471,https://www.benzinga.com/trading-ideas/movers/26/05/52668418/whats-going-on-with-nebius-stock-tuesday-2,2026-05-20 21:02:14,2026-05-20,Google
07903767fe613ec7,GOOGL,Google,2026-05-27 06:09,Seeking Alpha,gnews,Alphabet: The Outperformance Opportunity Has Moved To A New Mag 7 Company,"Alphabet: The Outperformance Opportunity Has Moved To A New Mag 7 Company. Alphabet: The Outperformance Opportunity Has Moved To A New Mag 7 Company
Michael B Howard
1.14K Followers
Comments
Summary
Alphabet has rapidly achieved market cap dominance over Microsoft, far sooner than anticipated.
GOOGL's valuation now reflects... [3887 chars]",0.785,positive,0.785,1.56,1.2247,https://seekingalpha.com/article/4909016-alphabet-the-outperformance-opportunity-has-moved-to-a-new-mag-7-company,2026-05-27 21:02:31,2026-05-27,Alphabet
5fb64fdfa93720a3,GOOGL,Google,2026-05-27 13:32,Finbold,gnews,"Traders predict Google stock price for May 31, 2026","Traders predict Google stock price for May 31, 2026. Prediction market traders are signaling that shares of Alphabet (NASDAQ: GOOGL) are likely to remain near current levels by the end of May 2026.
Insights from cryptocurrency prediction market Polymarket indicate that the technology stock is likely to... [2342 chars]",0.0,neutral,0.4948,1.32,0.0,https://finbold.com/traders-predict-google-stock-price-for-may-31-2026/,2026-05-28 21:07:15,2026-05-28,Google
370ec97306ab2925,GOOGL,Google,2026-05-31 13:24,TNW,gnews,LG Electronics stock jumped 24% in a day after unveiling Google-based car tech that cuts automaker costs,"LG Electronics stock jumped 24% in a day after unveiling Google-based car tech that cuts automaker costs. TL;DR
LG Electronics surged 24% after unveiling Android Automotive-based car display tech. The system cuts multi-display deployment costs for automakers.
LG Electronics shares surged as much as 23.95% after the company announced a range of automotive... [2614 chars]",0.929,positive,0.929,1.32,1.2263,https://thenextweb.com/news/lg-electronics-stock-surge-google-android-automotive,2026-06-01 22:01:33,2026-06-01,Google
e7a66a23442600ab,GOOGL,Google,2026-06-01 19:02,Barchart,gnews,"If You Want to Invest in AI Without Losing Sleep, Buy Google Stock Now","If You Want to Invest in AI Without Losing Sleep, Buy Google Stock Now. The artificial intelligence race has divided the stock market into two camps. On one side, manufacturers of hardware with their astronomical multipliers. On the other, a multitude of startups, promising to disrupt the market, but for now burning capi... [5888 chars]",0.0,neutral,0.6641,1.32,0.0,https://www.barchart.com/story/news/2241484/if-you-want-to-invest-in-ai-without-losing-sleep-buy-google-stock-now,2026-06-02 21:48:04,2026-06-02,Google
